{
  "$schema": "../cases.schema.json",
  "schemaVersion": 2,
  "benchmark": "CosmoEdge 1.1 small-model capacity benchmark",
  "platformId": "rv1126b",
  "platform": "RV1126B",
  "scope": "additional-experimental-platform",
  "evidenceDate": "2026-08-19",
  "caseCount": 9,
  "gates": {
    "minFpsRatio": 0.8,
    "maxMissingRate": 0,
    "maxAverageDiscardRate": 0.05,
    "maxCriticalPathLatencyMs": 200,
    "maxDetectorLatencyMs": 150
  },
  "cases": [
    {
      "caseId": "dual-cv-5fps-4ch",
      "workload": "dual-detector",
      "targetFps": 5,
      "configuredChannels": 4,
      "outcome": "completed",
      "boundaryKind": "lower-bound",
      "lastPassingChannels": 4,
      "firstBlockedChannels": null,
      "blockedReason": null,
      "sourceSummarySha256": "ce030e9b152e2ae1ca144d88e494cb1f903822924d2dbfda97b421bffc36308f",
      "steps": [
        {
          "channels": 1,
          "holdSeconds": 30,
          "result": "PASS",
          "tasks": [
            {
              "name": "person-detector",
              "targetFps": 5,
              "minimumProcessingFps": 5.24,
              "minimumFpsRatio": 1.048,
              "missingRate": 0,
              "averageDiscardRate": 0,
              "maximumDetectorLatencyMs": 42.8,
              "maximumCriticalPathLatencyMs": 46.2
            },
            {
              "name": "safety-helmet-detector",
              "targetFps": 5,
              "minimumProcessingFps": 5.17,
              "minimumFpsRatio": 1.034,
              "missingRate": 0,
              "averageDiscardRate": 0,
              "maximumDetectorLatencyMs": 42.8,
              "maximumCriticalPathLatencyMs": 52.7
            }
          ],
          "minimumProcessingFps": 5.17,
          "maximumDetectorLatencyMs": 42.8,
          "maximumCriticalPathLatencyMs": 52.7,
          "averageDiscardRate": 0,
          "maximumChannelDiscardRate": 0,
          "acceleratorPeakPercent": 8,
          "acceleratorMemoryPeakPercent": null,
          "cpuPeakPercent": 11,
          "memoryPeakPercent": 21,
          "failureReason": null
        },
        {
          "channels": 2,
          "holdSeconds": 30,
          "result": "PASS",
          "tasks": [
            {
              "name": "person-detector",
              "targetFps": 5,
              "minimumProcessingFps": 5.14,
              "minimumFpsRatio": 1.027,
              "missingRate": 0,
              "averageDiscardRate": 0,
              "maximumDetectorLatencyMs": 42.1,
              "maximumCriticalPathLatencyMs": 45.4
            },
            {
              "name": "safety-helmet-detector",
              "targetFps": 5,
              "minimumProcessingFps": 5,
              "minimumFpsRatio": 1,
              "missingRate": 0,
              "averageDiscardRate": 0,
              "maximumDetectorLatencyMs": 42.1,
              "maximumCriticalPathLatencyMs": 53.8
            }
          ],
          "minimumProcessingFps": 5,
          "maximumDetectorLatencyMs": 42.1,
          "maximumCriticalPathLatencyMs": 53.8,
          "averageDiscardRate": 0,
          "maximumChannelDiscardRate": 0,
          "acceleratorPeakPercent": 16,
          "acceleratorMemoryPeakPercent": null,
          "cpuPeakPercent": 21,
          "memoryPeakPercent": 25,
          "failureReason": null
        },
        {
          "channels": 3,
          "holdSeconds": 30,
          "result": "PASS",
          "tasks": [
            {
              "name": "person-detector",
              "targetFps": 5,
              "minimumProcessingFps": 5.14,
              "minimumFpsRatio": 1.028,
              "missingRate": 0,
              "averageDiscardRate": 0,
              "maximumDetectorLatencyMs": 42.7,
              "maximumCriticalPathLatencyMs": 46
            },
            {
              "name": "safety-helmet-detector",
              "targetFps": 5,
              "minimumProcessingFps": 5.02,
              "minimumFpsRatio": 1.004,
              "missingRate": 0,
              "averageDiscardRate": 0,
              "maximumDetectorLatencyMs": 42.7,
              "maximumCriticalPathLatencyMs": 54.4
            }
          ],
          "minimumProcessingFps": 5.02,
          "maximumDetectorLatencyMs": 42.7,
          "maximumCriticalPathLatencyMs": 54.4,
          "averageDiscardRate": 0,
          "maximumChannelDiscardRate": 0,
          "acceleratorPeakPercent": 24,
          "acceleratorMemoryPeakPercent": null,
          "cpuPeakPercent": 28,
          "memoryPeakPercent": 30,
          "failureReason": null
        },
        {
          "channels": 4,
          "holdSeconds": 30,
          "result": "PASS",
          "tasks": [
            {
              "name": "person-detector",
              "targetFps": 5,
              "minimumProcessingFps": 5.15,
              "minimumFpsRatio": 1.03,
              "missingRate": 0,
              "averageDiscardRate": 0,
              "maximumDetectorLatencyMs": 46.6,
              "maximumCriticalPathLatencyMs": 49.8
            },
            {
              "name": "safety-helmet-detector",
              "targetFps": 5,
              "minimumProcessingFps": 5.07,
              "minimumFpsRatio": 1.014,
              "missingRate": 0,
              "averageDiscardRate": 0,
              "maximumDetectorLatencyMs": 46.6,
              "maximumCriticalPathLatencyMs": 58.6
            }
          ],
          "minimumProcessingFps": 5.07,
          "maximumDetectorLatencyMs": 46.6,
          "maximumCriticalPathLatencyMs": 58.6,
          "averageDiscardRate": 0,
          "maximumChannelDiscardRate": 0,
          "acceleratorPeakPercent": 31,
          "acceleratorMemoryPeakPercent": null,
          "cpuPeakPercent": 34,
          "memoryPeakPercent": 35,
          "failureReason": null
        }
      ]
    },
    {
      "caseId": "nohelmet-10fps-4ch",
      "workload": "safety-helmet-detector",
      "targetFps": 10,
      "configuredChannels": 4,
      "outcome": "completed",
      "boundaryKind": "lower-bound",
      "lastPassingChannels": 4,
      "firstBlockedChannels": null,
      "blockedReason": null,
      "sourceSummarySha256": "38ffd7a5a67c98ffbf2c36e7b893f35f93e50e4d0c3e63013ce6aa5d2c3f4ffb",
      "steps": [
        {
          "channels": 1,
          "holdSeconds": 30,
          "result": "PASS",
          "tasks": [
            {
              "name": "safety-helmet-detector",
              "targetFps": 10,
              "minimumProcessingFps": 10.14,
              "minimumFpsRatio": 1.014,
              "missingRate": 0,
              "averageDiscardRate": 0,
              "maximumDetectorLatencyMs": 38.7,
              "maximumCriticalPathLatencyMs": 49.8
            }
          ],
          "minimumProcessingFps": 10.14,
          "maximumDetectorLatencyMs": 38.7,
          "maximumCriticalPathLatencyMs": 49.8,
          "averageDiscardRate": 0,
          "maximumChannelDiscardRate": 0,
          "acceleratorPeakPercent": null,
          "acceleratorMemoryPeakPercent": null,
          "cpuPeakPercent": 17,
          "memoryPeakPercent": 39,
          "failureReason": null
        },
        {
          "channels": 2,
          "holdSeconds": 30,
          "result": "PASS",
          "tasks": [
            {
              "name": "safety-helmet-detector",
              "targetFps": 10,
              "minimumProcessingFps": 10.07,
              "minimumFpsRatio": 1.007,
              "missingRate": 0,
              "averageDiscardRate": 0,
              "maximumDetectorLatencyMs": 39.2,
              "maximumCriticalPathLatencyMs": 52.3
            }
          ],
          "minimumProcessingFps": 10.07,
          "maximumDetectorLatencyMs": 39.2,
          "maximumCriticalPathLatencyMs": 52.3,
          "averageDiscardRate": 0,
          "maximumChannelDiscardRate": 0,
          "acceleratorPeakPercent": null,
          "acceleratorMemoryPeakPercent": null,
          "cpuPeakPercent": 32,
          "memoryPeakPercent": 43,
          "failureReason": null
        },
        {
          "channels": 3,
          "holdSeconds": 30,
          "result": "PASS",
          "tasks": [
            {
              "name": "safety-helmet-detector",
              "targetFps": 10,
              "minimumProcessingFps": 10.15,
              "minimumFpsRatio": 1.015,
              "missingRate": 0,
              "averageDiscardRate": 0,
              "maximumDetectorLatencyMs": 40.4,
              "maximumCriticalPathLatencyMs": 53.5
            }
          ],
          "minimumProcessingFps": 10.15,
          "maximumDetectorLatencyMs": 40.4,
          "maximumCriticalPathLatencyMs": 53.5,
          "averageDiscardRate": 0,
          "maximumChannelDiscardRate": 0,
          "acceleratorPeakPercent": null,
          "acceleratorMemoryPeakPercent": null,
          "cpuPeakPercent": 43,
          "memoryPeakPercent": 47,
          "failureReason": null
        },
        {
          "channels": 4,
          "holdSeconds": 30,
          "result": "PASS",
          "tasks": [
            {
              "name": "safety-helmet-detector",
              "targetFps": 10,
              "minimumProcessingFps": 10.03,
              "minimumFpsRatio": 1.003,
              "missingRate": 0,
              "averageDiscardRate": 0,
              "maximumDetectorLatencyMs": 53.9,
              "maximumCriticalPathLatencyMs": 71.5
            }
          ],
          "minimumProcessingFps": 10.03,
          "maximumDetectorLatencyMs": 53.9,
          "maximumCriticalPathLatencyMs": 71.5,
          "averageDiscardRate": 0,
          "maximumChannelDiscardRate": 0,
          "acceleratorPeakPercent": null,
          "acceleratorMemoryPeakPercent": null,
          "cpuPeakPercent": 56,
          "memoryPeakPercent": 52,
          "failureReason": null
        }
      ]
    },
    {
      "caseId": "nohelmet-24fps-4ch",
      "workload": "safety-helmet-detector",
      "targetFps": 24,